{
  "schema": "app-passport.descriptor.v1",
  "kind": "context",
  "name": "India number tutor memory",
  "version": "1",
  "artifact_digest": "sha256:c609f75e2178fd8ada7d4e6ec3aa2cfb067115238291542ed662ef8bc6ba281d",
  "source_url": "https://github.com/AjnasNB/qarinah",
  "provenance": "synthetic-fixture",
  "capabilities": [
    "cited-context",
    "source-identity",
    "temporal-selection"
  ],
  "context": {
    "manifest_hash": "sha256:b94fd2391678055c412f4013583827f6d942e761726f2e0f44c3970e608a0d2e",
    "repository_digest": "sha256:d5c56af3e266d7fb1016bcfe1c9a6572b553a4be326c2f98df983f9019b30091",
    "compiler_version": "qarinah-0.6.0"
  }
}
